{
  "kicker": "지표 상한 검증가나다라마바사아",
  "title": "여섯 지표를 한 화면에 담는 상한가나다라마바사아",
  "metrics": [
    {
      "label": "지표 1 라벨가나다라마바사",
      "value": "-9,999",
      "unit": "만건가",
      "delta": {
        "dir": "up",
        "text": "증감 상한가나다",
        "tone": "good"
      },
      "spark": [
        1,
        2,
        3,
        5,
        8,
        13,
        21,
        34
      ]
    },
    {
      "label": "지표 2 라벨가나다라마바사",
      "value": "123,45",
      "unit": "만건가",
      "delta": {
        "dir": "down",
        "text": "증감 상한가나다",
        "tone": "good"
      },
      "spark": [
        1,
        2,
        3,
        5,
        8,
        13,
        21,
        34
      ]
    },
    {
      "label": "지표 3 라벨가나다라마바사",
      "value": "9,999",
      "unit": "만건가",
      "delta": {
        "dir": "flat",
        "text": "증감 상한가나다",
        "tone": "neutral"
      },
      "spark": [
        1,
        2,
        3,
        5,
        8,
        13,
        21,
        34
      ]
    },
    {
      "label": "지표 4 라벨가나다라마바사",
      "value": "1,234",
      "unit": "만건가",
      "delta": {
        "dir": "down",
        "text": "증감 상한가나다",
        "tone": "bad"
      },
      "spark": [
        1,
        2,
        3,
        5,
        8,
        13,
        21,
        34
      ]
    },
    {
      "label": "지표 5 라벨가나다라마바사",
      "value": "99,99",
      "unit": "만건가",
      "delta": {
        "dir": "up",
        "text": "증감 상한가나다",
        "tone": "bad"
      },
      "spark": [
        1,
        2,
        3,
        5,
        8,
        13,
        21,
        34
      ]
    },
    {
      "label": "지표 6 라벨가나다라마바사",
      "value": "8,888",
      "unit": "만건가",
      "delta": {
        "dir": "flat",
        "text": "증감 상한가나다",
        "tone": "neutral"
      },
      "spark": [
        1,
        2,
        3,
        5,
        8,
        13,
        21,
        34
      ]
    }
  ],
  "omitted": 12,
  "note": {
    "pre": "풋노트 앞 구간 상한 검증가나다라",
    "strong": "강조 상한가나다라마바사",
    "post": "풋노트 뒤 구간 상한가나다라마바사"
  },
  "frame": {
    "brand": "ReportArchive 브랜드가나다라마바사",
    "idx": "07",
    "total": "07"
  }
}
